index,id,message,uuid,label
116,https://clab.org.tw/events/future-vision-lab-2022kh/,分享2022台灣燈會把直徑12公尺、高6公尺的球形構築「DOME」，搬到衛武營的草地了。由臺灣當代文化實驗場（C-LAB）科技媒體實驗平台的實驗展演計畫「FUTURE VISION LAB」，打造的超高解析度沉浸式影音體驗空間「DOME」，運用校正、融接、對位、播放控制與影像前置等多項複雜技術，才能投映出無接縫的球形曲面影像，內部輔以鏡面地板的反射成像，呈現一體化的球體空間，觀看時有「裸眼VR」的意味，貼合「未來視覺」的前衛設定。「FUTURE VISION LAB@2022台灣燈會」，跳脫農林畜牧水土等對農業的刻板印象，呼應當代科技互動趨勢，透過全沉浸式影音體驗空間，作品內容包含自然、地景、植物等相關元素的多元面向呈現，反映順天應時、自然節氣的廣義農業精神與內涵；以科技與當代藝術創作，詮釋最具土地感的農業主題，翻轉大眾對傳統燈會作品形式的想像。2022台灣燈會邀請您走入「DOME」，觀賞新銳科技藝術創作者們帶來的精彩作品及觀星講座。過年時節，為自己預約一場融合音像藝術、演算藝術與實驗動畫的視覺旅程。播映作品：A1. 莊禾《夜遊》A2. SYNZR《On Earth Series: Dome》B1. 趙珮妤《花之間》B2. 田所淳《和諧複變》C1. NANONANO《HETEROTOPIA: Dome》C2. 黃偉Ｘ鄭道元Ｘ黃國斌《INNERSTAR 01 : Reddening》（精華版）D. 李昫岱《星空探索｜天文觀星講座》E. 蔡奇宏Ｘ柯智豪《Re-Generative:: update()》FUTURE VISION LAB @ 2022台灣燈會活動時間：2022年1月29日（六）至2022年2月28日（一），每天6-10pm（最後一場次為9:40pm）活動地點：衛武營都會公園 北側（,b0becc57-f973-461a-8d9c-e5ea2b0f3d6b,1
117,https://artemperor.tw/tidbits/12142,相關連結2021金車咖啡插畫獎基金會於2009年至2013年連續五年舉辦「咖啡杯創意設計比賽」，這些年來共增得八千多件作品投稿，更有超過一百四十萬人次的活動瀏覽人數，活動效果與反饋極佳。為持續推廣與鼓勵設計及藝術創作者，2018年至今仍持續舉辦此比賽，期望藉由藝術與伯朗咖啡結合，增進大眾對美學的接觸與認識。2021年為延續大家對創作的熱情，續辦此比賽時，不僅增加每人投稿總件數、提高比賽總獎金外，也正式更名為「金車咖啡插畫獎」。總獎項共有首獎1位、特優３位、優選17位。因參賽者們投稿踴躍，此次2021金車咖啡插畫獎共徵得991件作品。今年徵件主題以「日常。咖啡」為創作發想。近期台灣社會比以往多了些動盪，希望藉由咖啡插畫徵件，讓創作者將日常的微小事物或氛圍加入咖啡元素，表達具象或抽象的創作畫面，傳達平和、安定與溫暖的意念。2021金車咖啡插畫獎由HARUKO創作〈未來，展開新啡〉榮獲首獎殊榮，特優三位分別是Moray〈咖啡色的空想〉、Evil.faucet〈美好時光〉、Wei-hsuan〈日常〉。獲選優選的十七位為Bella Wang〈來一杯溫暖〉、班森學字〈在家上班日常－深夜使人靈感無限〉、晴天雨〈倘佯咖啡海〉、端端〈啡河印象〉、ellychang〈有彼此的日子〉、Sophia Ji〈思如泉湧．咖啡〉、Mori〈完美的一天 My Perfect Day〉、Mirin〈下午兩點〉、吳嘉鴻〈森林裡的野人咖啡〉、吳政倫〈早安！城之美〉、Lanfang Lin〈和你一起的平凡晨光〉、Yuchi〈生活〉、PJH〈歡迎來到，萃取魔術師的咖啡室。〉、Timmy〈窗〉、1chunn〈早晨儀式〉、楊十四〈我的咖啡犬〉、wen〈療癒時光〉。本屆的評選過程十分熱烈，評審們也在其中看到許多具有水準的優秀作品。希望藉由此比賽鼓勵創作者累積個人作品，將創作生活化，並透過藝術與設計，帶給社會更多正向美好的能量。,c7d781c3-b17b-439c-8826-ac7dc894dfdf,1
118,https://artemperor.tw/focus/4603,2022-01-27｜撰文者：國立臺灣美術館/非池中藝術網編輯整理第三屆的光影藝術節將光影、科技、藝術三者充分結合，共創出全新型態的藝術展演形式，同時，也創建了讓年輕藝術家及國外的精彩創作，展現及交流互動的重要平臺。今年在文化部支持下光影節的作品數量、規模與尺度也隨之提升，尤其在5G技術的應用升級下，互動串流作品比例為三年之最。國美館說明，除了打造精彩魔力的光影舞台之外，也規劃了一系列精彩相關活動，包括以互動科技及5G為主題的國際論壇、藝術家講座，以及多場親子活動，歡迎民眾一起參加。同時將在2月25日至3月20日間，以國美館全新打造的沉浸式劇場「U-108 Space」為舞台，與日本大阪藝術大學同步展出，由臺日藝術家共同創作的全新5G作品〈你的肢體笑顏 將是我的全部〉，發表一場臺日異地共演的全新節目。〈陽台城市文明-模造光城遊境〉本作拼裝物件原始的塗層色彩與在夜晚所散發的螢光代表白天與黑夜兩個概念，白天的城市文明與夜晚都會不夜城相互對應，一座城市反應著兩種面相，進而啟發觀者反思。這些生活模組物件被安置在具臺灣本島、臺中市與臺南市地圖外型的基地之中，並拼組出都會城市與廟宇神殿的樣貌，隱喻人們在都會文明中的壓抑及殘酷的現實壓力與精神寄托的交織。〈陽台城市文明-模造光城遊境〉，2021，木材、螢光漆、LED燈等複合媒材，尺寸 : 臺灣 4.0m(寬)×0.1m(高)×2.5m(長)；臺中 2.5m(寬)×0.1m(高)×1.5m(長)；臺南 2.0m(寬)×0.1m(高)×2.0m(長)。圖 / 國美館提供。關於藝術家林書楷1983年生於臺灣臺南，國立臺北藝術大學美術系與美術創作研究所畢業，現居於臺南。林書楷的創作以平面繪畫和空間裝置為主。 藝術家生長於臺南，其創作養分深受這座充滿廟宇、彎曲巷弄及宗教圖騰的古都影響，汲取這些視覺和空間經驗加以內化，並由個人生命經驗和體悟，經過多重拆解、重組，發掘出潛意識的創作符號。藝術家林書楷。圖 / 國美館提供。〈你的肢體笑顏 將是我的全部〉表達自己的心情是所謂的「情緒」，而「情緒」是一種複雜的表情與肢體語言綜合體。然而因為疫情關係，人們的互動變成沒有肢體語言的線上會議，或是隱藏在口罩下沒有表情的線下見面。此作即是希望透過5G技術的即時影像辨識與傳輸，將所捕捉到的各種肢體與表情進行各式的「交匯」與「融合」，藉以探討在疫情之後，人與人之間「社交」的可能性。▌互動說明1. 站在展場攝影機前面，進行即時動態影像擷取擷取觀眾身體的一部份，以拼貼方式顯像於投影畫面2. 掃瞄 QR Code 並下載 APP，錄製自己的臉上傳至資料庫，臉部動態影像局拼貼將隨機顯示於投影畫面〈你的肢體笑顏 將是我的全部〉，2021-2022，5G互動影像裝置，尺寸依場地而定。圖 / 國美館提供。關於藝術家－安藤英由樹、純禾作（陳依純、羅禾淋）安藤英由樹目前為大阪藝術大學藝術系藝術科技組教授，研究心理知覺及虛擬實境，近年並致力於促進正能量生活(Wellbeing)的研究，探討資訊科技的可能性，除了開發介面的研究之外，還對科技作為藝術表現形式的社會貢獻感興趣，從而發展出自己的藝術創作。純禾作是由美術背景的錄像藝術家陳依純、理工背景的互動藝術家羅禾淋，於2010年共同組成的跨域新媒體藝術團體。陳依純主要專業於平面繪畫、敘事研究、影像動畫、科技劇場；羅禾淋專攻於程式設計、機構動力裝置、展演規劃。兩人共同創作的作品以跨域的方式執行藝術計劃，展演於世界各地新媒體電子藝術節和美術館。(左)安藤英由樹，(中)陳依純，(右)羅禾淋。圖 / 國美館提供。展覽資訊戶外展覽：𝟐𝟎𝟐𝟏.𝟏𝟐.𝟐𝟓-𝟐𝟎𝟐𝟐.𝟐.𝟐𝟖 𝟏𝟕:𝟎𝟎 -𝟐𝟐:𝟎𝟎 (除夕及初一照常開放)室內展覽：𝟐𝟎𝟐𝟐.𝟐.𝟐𝟓-𝟐𝟎𝟐𝟐.𝟑.𝟐𝟎 𝟎𝟗:𝟎𝟎 -𝟏𝟕:𝟎𝟎 (星期一休館),9e658ccd-564b-4c80-9bfc-c42ac69f9ee8,1
119,https://artemperor.tw/tidbits/11947,台灣，台中市大河美術首次舉辦臺灣塗鴉藝術聯展──「 塗鴉俱樂部 GRAFFITI SOCIAL CLUB 」，延續朱銘美術館「 無限－塗鴉俱樂部 」展覽，由大河美術及其代理塗鴉藝術家 REACH 共同策展，邀請九位藝術家：AIKS、BLACKZAO、COLASA、DISK、DZUSONE、MR.OGAY、REACH、SEAZK 以及 SONG，涵蓋臺灣塗鴉藝術跨世代發展的老中青三代，不限主題及形式，呈現一檔無框架展覽。本展更特別企劃，與美國百年運動品牌 Mitchell ＆ Ness 聯名合作，由藝術家們在不同的 NBA 經典復古球衣上創作，成為一大亮點，也展現塗鴉藝術與籃球文化密不可分的關係。11/6（六）下午 3 點開幕，將邀請 9 位參展藝術家現場表演 Live Painting，以及臺灣知名嘻哈 DJ CHICANO 現場刷碟，搭配臺虎精釀啤酒與觀眾一同啜飲，透過「 俱樂部 Club 」意象，營造塗鴉與街頭文化的自由氛圍，期望提高藝術愛好者對塗鴉藝術的關注度，邀請您一同享樂。「 塗鴉俱樂部 GRAFFITI SOCIAL CLUB 」歡迎你！｜展期｜2021 / 11 / 6 (六) - 12 / 31 (五)｜開幕｜2021 / 11 / 6 (六) 3 PM,65901d41-7772-48af-ab50-44187daf2344,1
120,http://angelfly.com.tw/angel/?tag=%e8%83%bd%e9%87%8f%e7%a5%9d%e7%a6%8f,這幾天我傑克希的行程 都被排滿，除了帶領「光的課程」，一方面就是進行「遠距視訊 天使靈性諮詢」！所以比較沒有機會上來 碎碎念～ 而明天早上還要去幫一位粉絲朋友 進行「入新居&開店 能量祝福」！！ 話說之前都是用「神聖幾何 能量曼陀羅」進行開光祝福～ 明天早上的案子，突然有新靈感，想為這位美人打造「能量祝福花束」！！ 結果，曾經一位跟我一起學習身心靈的一位美人朋友，她本身也有特殊「能量敏感體質」，而且已經投入「花藝設計」有一年時間⋯ 這幾天想到，可以請她幫我執行 「能量祝福 花藝設計」！ 我傑克希 先將收到的「天使祝福訊息」，先轉達給這位「能量花藝設計師」是否曾經，你喜歡過什麼？但後來再也不喜歡了⋯ 是否曾經，你期待過什麼？但後來再也沒熱情了⋯ 防疫期間，很開心我媽能長時間在台中，跟我傑克希一起居住，幫我料理三餐，照顧我的起居生活，有媽的孩子是個寶，讓我在這個青壯年歲數，依然能當個“老小孩”⋯ 但是，我媽生活中的一個「下意識反應」，卻常讓我有不解之處⋯ 就是，她「非常討厭寵物」！ 但有趣的是，我傑克希的天使住家， 跟我一起住的，剛好有「一隻白狗 + 一隻黑貓」！ 「白狗 ㄉㄨㄞ ㄉㄨㄞ」，溫馴可愛 又有點膽小，實在稱不上是有殺傷力的一個存在⋯ 但另外一個「白目 狠角色」可就不能等閒視之！就算你好好待在一個地方，他也昨天 天使靈性諮詢滿檔，其中一位美人，她有正在跟隨的「心靈老師」，對方會為她進行「能量加持」，也有販售推廣「能量精油」，可是不知道為什麼，每次她接收「能量加持 & 能量精油」後，反而變得「更不舒服」⋯ 其實類似這樣的事情，很難立即以「身體當下反應」，來當作￼能量好壞判斷￼⋯ 因為，的確有一些「高頻能量」在觸及當事人的身心靈磁場時，是有可能帶來「代謝排毒反應」，在那短暫過渡期，的確會覺得暈眩，會有短暫不舒服感覺⋯ 就像家裡的廁所馬桶，長年阻塞，這時使用有機清潔劑，要暢通水管的過程，便會讓水管裡面的排泄物異味，瞬間湧出，而短暫覺得廁所氣味不舒適⋯ 如果是在這ㄧ位美人，多年多年前，曾經接受過我傑克希 帶來的「天使靈性諮詢」服務，那時我還沒開店，還正在擺文創市集&路邊攤的過程，她只記得在那一次服務中，「哭得很慘」，她知道自己必須往前走，不要再困在沒有緣分的男朋友身旁⋯ 再次見到面，沒想到我們已經開店，而且一晃眼就過了八年多⋯ 但奇怪的是，美人卻「從此單身」沒辦法再進入一段穩定的感情⋯ 這八年多的過程，該去拜拜的月老廟、該去祈求的神明，幾乎一個都沒少，可是不知道為什麼「總是沒有情感因緣」！！ 進入「天使能量場」時， 我說，因為： 「你的頭腦，大過你的心。」 你總是用「頭腦」 去判斷對方的社會條件，適不適合你， 那,495d42cf-ed66-434a-b235-f8d8345b09b2,0
121,https://artemperor.tw/focus/4349,拉黑子·達立夫、張致中、邱杰森與莫珊嵐參展「2021日惹雙年展臺灣館」 ARTWAVE、高美館與台亞基金會聯手打造藝術外交新航線2021-10-04｜撰文者：非池中藝術網編輯整理日惹雙年展從2011年以赤道作為主題觀念，讓各地藝術家可以開放式地參與對話。 赤道是世界緯度的起點，每兩年透過赤道計畫，雙年展與赤道地區的國家合作。從2021年開始，我們也陸續跟大洋洲的國家合作。也因此很期待透過雙年展中的臺灣館，與臺灣對於泛南島的關注進行交流。──日惹雙年展策展人阿莉亞．斯瓦斯帝嘉 (Alia Swastika)ARTWAVE線上跨國記者會合照_國藝會林曼麗董事長(左上)、台亞基金會蕭新煌董事長(中上)、高美館李玉玲館長(右上)、日惹雙年展基金會Alia Swastika總監(左下)、越南VICAS副院長阮氏秋芳(右下)。圖/國家文化藝術基金會提供財團法人國家文化藝術基金會（以下簡稱「國藝會」）ARTWAVE攜手高美館泛南島藝術祭、台亞基金會，同步啟動「2021 日惹雙年展台灣館」與「第三屆亞洲策展論壇」！國藝會於2018年創設「ARTWAVE——台灣國際藝術網絡平台」（ARTWAVE —Taiwan International Arts Network），積極推動台灣藝術與國際鏈結，在｢廣設台灣館｣的策略項目上，2019年首度與日惹雙年展基金會合作，於第15屆日惹雙年展中創設「台灣國家館」（Bilik Nasional Taiwan），除順利促成多位台灣藝術家參與該屆雙年展之外，也與日惹雙年展基金會達成持續合作之默契。在向外開拓各項國際合作的同時，國藝會亦尋求與國內各大場館的結盟，期待在整合各方的專業與資源下，持續擴充相關計畫所能發揮的最大效益。在此概念下，2021年國藝會除邀及高雄市立美術館共同規劃「第16屆日惹雙年展」的台灣國家館外，也將偕高美館與臺灣亞洲交流基金會共同策辦「第三屆亞洲策展論壇」。日惹雙年展以赤道國家作為主題今年邁入第六屆，此次以大洋洲(Oceania)為主題，目光聚焦於探索南島民族寄居的千島之國（又譯努山達拉，Nusantara）與太平洋域（Pacificscape），本屆日惹雙年展策展人艾麗亞·内薇斯塔 (Elia Nurvista)與阿佑斯·波宛吉（Ayos Purwoaji）期望藉由「誰擁有海洋？」（Ｗho owns the ocean?）的提問，呼籲人們應放下傳統的國家疆界，以重新探索與認識這片廣大的海域所孕育的多元文化及族群。《旅行在50步的空間》作品系列2015展出舊照-藝術家拉黑子每日外出繪畫的袋子、工具、跟畫布。圖／藝術家提供由於日惹雙年展延續多屆之核心關懷與本屆的策展主題，與高美館在其主辦之「2021泛‧南‧島藝術祭」中所強調「以島嶼/海洋而非陸塊作為關注基準點」與「擁抱海洋流動與去疆界的特質」，可說是完全呼應，因此高美館自「2021泛‧南‧島藝術祭」的參展藝術家中選出拉黑子．達立夫、張致中，以及邱杰森與莫珊嵐（Margot Guillemot）雙人組合代表參展本屆日惹雙年展台灣館。2021日惹雙年展台灣館將從歷史、地緣、文化、情感等面向反思我們與海洋的依存關係，重新思考人類對海洋資源的開採、占奪與取用，以及海洋在工業技術、殖民拓展、現代化的過程中，被劃入人類∕人為領域的影響，重新以海洋生態系統來認識這個領域，並重建我們對海洋的記憶與情感。拉黑子．達立夫的《旅行在五十步的空間》與《颱風行動計畫》兩件作品是從撿拾海洋漂流廢棄物出發延展出一系列作品，從身份認同、神話傳說、生命經驗與海洋環境的角度，將這些人類生活中被遺棄的殘片重新縫合、拼貼及裝置，指引出精神與環境連結的共存世界觀。藝術家拉黑子．達立夫。圖/國家文化藝術基金會提供張致中的《海不平面》主要從科學與社會等角度討論海並非平面的事實，包含暖化海面上升、太平洋十年濤動的大氣觀察、島嶼∕濱海陸地消失等社會議題。邱杰森與莫珊嵐的《雅加達事件簿》則是以海洋史、殖民路徑史的虛構再書寫，重構一個從外部權力觀看的歷史。邱杰森＆莫珊嵐作品《雅加達事件簿》於「泛・南・島藝術祭」展覽現場。圖/國家文化藝術基金會提供（攝影／王世邦）藝術家邱杰森與莫珊嵐。圖/國家文化藝術基金會提供除了本屆日惹雙年展台灣館的策劃參展，國藝會亦將與新南向民間智庫台亞基金會、印尼日惹雙年展基金會及越南國家文化藝術研究院（VICAS）等ARTWAVE 國際網絡夥伴，在日惹雙年展展出期間，於10/23-24日假高美館舉辦「第三屆亞洲策展論壇」，論壇將以「環‧球」、「越‧南」、「洋‧面」等三大主題，取其｢環顧全球，跨越南方，面對海洋｣的精神，來搭建台灣、印尼、東南亞與大洋洲區域之間的對話。第三屆亞洲策展論壇預計邀請包括阿莉亞．斯瓦斯帝嘉（Alia Swastika，日惹雙年展基金會總監）、埃德．達瑪萬(Ade Darmawan，第15屆卡塞爾文件展藝術總監）、 阮氏秋芳(Nguyen Thi Thu Phoung，越南VICAS副院長)等策展人及藝術家與會，以台灣高雄為實體據點，國外講者連線出席，這場虛實整合的策展論壇，將聚焦台灣與全球南方的文化交流。國藝會董事長林曼麗表示，ARTWAVE「廣設台灣館」的項目，以「BOT」（建立Built、操作Operate、移轉Transfer）為推動策略，而與日惹雙年展的合作，即是這個策略的具體實踐。藉由「建立」與日惹雙年展的合作關係，以及實際「操作」首屆台灣館的展覽呈現，並在擴大視野與連結的目標下，進一步進行「移轉」媒合，期使ARTWAVE所開發的路徑資源，能持續為國內外當代藝術界所運用，如同無垠洋面上的長浪(wave)，推波助瀾，透過藝術參與，營造台灣獨立自主(independence)，整合多贏的國際局面。張致中作品《海不平面》於「泛・南・島藝術祭」展覽現場照。圖/國家文化藝術基金會提供（攝影／王世邦）台亞基金會董事長蕭新煌認為，以人為本的文化交流是台灣新南向政策成功與否的關鍵之一。海洋文化與南島民族遷徙是台灣與東南亞之間最長遠的歷史淵源。新南向政策未來應透過南島藝文合作，展開更多民間交流。蕭董事長進一步表示，「本次日惹雙年展與亞洲策展論壇的跨國合作，不僅是推進新南向文化交流的重要合作，也讓人充分感受南島藝文創作的活潑能量。」高美館館長李玉玲表示，自2017年來以「大南方/South Plus」新座標重新定位高美館，連結到此次的「泛．南．島藝術祭」，「更進一步以『泛』－跨越邊界的視野、『南』－則是多元與非中心收束的觀點、『島』－則象徵海洋文化多邊連結的概念精神，」 鬆脫南島單一語系、及對藝術家血緣、族裔的侷限，以及北半球陸塊固著的中心思維，帶向更廣闊的跨區域文化對話。「很開心剛起步的『泛．南．島藝術祭』能與已有16屆歷史的『日惹雙年展』品牌聯名展出，除發揮發散的加乘效益之外，更重要的是，能同時將台灣藝術家推向世界的藝術舞台。」,08fb6b30-ce8c-43e1-a012-998193b0d654,0
122,https://artemperor.tw/tidbits/12096,潘重光潘重光，來自台灣屏東縣，1995出生，畢業於國立屏東大學視覺藝術學系，現為國立高雄師範大學美術研究所碩士班。在我的認知裡，「風景」是人創造出來的，人們所處的現實場域並非「風景」，我認為經過時間及人們的情緒會重新建構出「風景」，而我把自身經驗、情緒經過時間的積累再以繪畫的形式把這片「風景」建構出來。每個人的生命歷程不盡相同，願任何想逃離現實生活的人們，都能夠進入我的作品裡！「離型」這詞，就是由翻模所使用的離型劑所衍生，使內外模易於脫離模具，使模具表面無殘留物質，加快生產速度及提升生產品質的媒介。人與人之間沒有離型劑，在分離個體或群體時，身上難免有剝落或殘留、沾黏的情感，這些情感或許經由時間逐漸式微，但卻還是如影隨形，以致難以分辨所處的環境是此時或彼時的風景。--------------------------《離 型 之 海》潘重光創作個展Sea of Release agent展期∣ 2021.12.18 - 2022. 02 .06,792629ca-55d1-4108-acb8-3fbc64cf37e1,1
123,https://artemperor.tw/tidbits/12002,參展藝術家王佳以、王枚鈴、王秀甄、王群、江宇、江秋霞、朱軼楠、李玫俶、李美鈴、吳絲絨、周妙文、林美蕙、林維蕙、邱泰洋、洪春成、馬丁‧李茂添、馬步月、翁鴻盛、張秉宏、張若琳、許美月、許美英、陳宇眉、陳縈禎、彭俞心、童凱俐、黃千玲、葛映惠、廖文雪、廖迎晰、趙純妙、劉雪娥、謝淑慧大象藝術空間館台灣，台中市在大肚山上遠離塵囂，融合東西方美學集大成的美麗學府，東海大學是臺灣高等教育發展史上第二所大學，而美術學系，一個孕育美感教育的搖籃，在創系系主任也是美學大師蔣勳教授，與歷屆系主任、教授以多元化藝術教育，提倡自由學風為導向的擘畫之下，為東海大學培育了無數優秀的藝術人才。畢業於研究所碩士班與碩專班的歷屆校友，這一群美的使者，在離開學校多年後仍不忘初衷，於2013年由王瑋名學長等人發起，籌組「東碩畫會」。一方面凝聚東海大學美術研究所畢業校友的情誼，也延續校友們創作的熱情和能量，建構一個平台讓大家可以一起切磋、交流、學習成長，也一起互相鼓勵彼此扶持，在藝術美學的道路上回歸本質繼續耕耘，並將大家平時創作的成果發表展出，要用藝術美學來妝點臺灣這塊土地的美麗。天地有大美而不言，靜水流深大象無形，2021「東碩畫會」東海大學美術研究所碩士班與碩專班畢業的校友，這群美的播種者，繼嘉義縣梅嶺美術館聯展之後來到「大象藝術空間館」，以全新的作品全新的面貌展出，在2021的歲末時節，與您分享創作的喜悅。(節錄自東碩畫會會長與展覽策展人邱泰洋策展論述)展覽名稱 ：東海美的烙印在大象-東碩畫會聯展展出時間 ：2021 / 11 / 27 – 12 / 31開幕茶會 ：11/ 27 (六) 15:00策 展 人 ：邱泰洋藝 術 家 ：(依筆劃排序)王佳以、王枚鈴、王秀甄、王群、江宇、江秋霞、朱軼楠、李玫俶、李美鈴、吳絲絨、周妙文、林美蕙、林維蕙、邱泰洋、洪春成、馬丁‧李茂添、馬步月、翁鴻盛、張秉宏、張若琳、許美月、許美英、陳宇眉、陳縈禎、彭俞心、童凱俐、黃千玲、葛映惠、廖文雪、廖迎晰、趙純妙、劉雪娥、謝淑慧,abec3fc4-39e0-4453-be95-710c09f2b964,1
124,https://artemperor.tw/tidbits/12094,ATI、CR、雖小龍女、莊佳宜、張育嘉、FANKO、DEBE、陳硯平、謝怡如、CASIMIR、BIJIJOO、BOUNCE、Loes van Delft、Igor Dobrowolski、SOYAMAX、REACH、Chihiro Nakahara⚫️OneOffs X Lootex X MaiCoin X XRSPACE隨著 NFT 市場的爆發，以及 NFT 對於藝術品的適切性，OneOffs 團隊將於聖誕佳節期間，NFT數位藝術、表演藝術、當代藝術、和潮流文化等元素，在 W Taipei 舉辦首屆的虛實合一藝術博覽會 – OneOffs NFT International Art Fair。透過結合區塊鏈 NFT 技術，本展會與參展畫廊一起推廣台灣本地藝術家們至國際市場。結合亞洲觀點，從台灣為出發，透過社群與區塊鏈市場的擴散和連結，架構出一個嶄新結構的多元藝術博覽會，一起聚焦藝術元宇宙！,10d98c3d-7797-46ee-b4e3-be8429c2b0f9,1
