index,id,message,uuid,label
187,http://europechinese.blogspot.com/2015/01/blog-post_6.html,去年年底寫過，歐洲政壇今年主題之一是極左冒起，以及與此相關的削減財赤問題。那麼，今年另一個主題，則是極右勢力蔓延，以及與此相關的移民問題。德國在５日晚上迎來２０１５年首場反移民、反伊斯蘭示威，而這場反移民運動過去數月不斷壯大下，「反反移民」的團體反擊，在５日至少在首都柏林、斯圖加特、科隆和最先有反移民示威的德東城市得雷斯頓舉行示威，其中科隆，包括地標大教堂在內多項建築物當晚熄燈（圖），以示反對這場反移民運動。這類反移民示威由「反西方伊斯蘭化愛國歐洲人」（Patriotischen Europäern gegen die Islamisierung des Abendlandes，簡稱ＰＥＧＩＤＡ）組織，最先由１０月開始，源於得雷斯頓，逢週一晚遊行，是仿效東德政權倒台前東德人逢週一晚遊行，不滿移民湧入，改變德國社會文人，令德國不再像德國，而且移民、包括難民在內搶去德國人福利。初時遊行有幾百人，但到上月底聖誕前的週一遊行，人數升至１．７５萬人，震驚德國政壇，令該國社會開始注視問題。ＰＥＧＩＤＡ的冒起受重視，對全歐洲有很大的象徵和影響，倒不是因為德意志的納粹歷史。相對於目前歐洲其他極右勢力，ＰＥＧＩＤＡ已算是最寬容的一個，亦（暫時）沒涉及暴力，即使示威者中包括一些法西斯滋事份子，但大家仍不相信這會變成納粹重現德國。ＰＥＧＩＤＡ的重要性在兩方面。象徵意義上，差不多其他全部歐洲國家，都至少有５年、甚至１０年以上，是出現了這類反移民／排外／恐外的勢力，例如法國的國民陣線可上溯至７０、８０年代，意大利的北方聯盟至少９０年代已出現，奧地利在９０年代就試過因為內閣包括極右政黨而遭其他歐盟成員國制裁，甚至芬蘭和瑞典這兩個北歐國家，真芬黨和瑞典民主黨也至少出現約５年。甚至在歐盟外，瑞士也試過通過禁止建清真寺塔尖的公投。但德國期間一直沒有這類勢力出現，這類勢力一直只局限在一些滋事份子，在政壇不成氣候，與ＰＥＧＩＤＡ示威中至少有一些是看上去應該是「正正常常」的人不同。若是前者，可當作罪案處理，但後者，政壇和社會就要正視他們的訴求。儘管德國「反反移民」的聲音仍算在歐洲各國中最強烈、亦最敢於公開反擊的，但始終，這類在歐洲多國出現的反移民聲音終於來到德國，這絕對有指標意義，反映有關問題在歐洲有多嚴重。而在實際意義上，移民問題今年、以至至少未來一、兩年，都會是歐洲政壇重要議題，英國與歐盟各國談判重新分配歐盟與成員國之間權力的新一輪歐盟改革討論中，移民／出入境問題是重中之重，而當中能夠一錘定音的是德國總理默克爾（Angela Merkel）。有關移民問題在歐盟層面政治，稍後再寫，此段想寫的重點是，默克爾被視為強烈支持歐盟各國人口自由流動原則，但如今德國都出現反移民聲音，尤其這股勢力會否跟反對歐元的疑歐政黨「德國另一選項黨」（ＡｆＤ）合流，搶去默克爾領導的基民盟（ＣＤＵ）票源，加上其早已有反移民傾向的姊妹黨基社盟（ＣＳＵ）可能因此在移民問題上轉趨強硬，這可能改變默克爾對國內移民政策的取態，繼而影響全歐盟的移民／人口自由流動政策。說來有點奇怪，雖然現在看起來，德國好像十分「反反伊斯蘭」，但其實只不過是１０年前，德國其實是最「疑伊斯蘭」的國家－－至少在西歐／「舊歐洲」中來說。人所共知，過去十多年，土耳其加入歐盟談判的最大障礙其實是默克爾，而同樣人所共知的是，她和ＣＤＵ真正阻撓土耳其的理由，是他們骨子裏認為伊斯蘭教不是歐洲文化的一部份，因此認為土耳其不能加入歐盟。不過，德國過去十多年出現微妙的變化，就是逐漸變成如美國般的「移民國家」。德國原本很抗拒移民，西德在６０、７０年代湧現大量土耳其外勞後，當中不少出現融入社會的問題，令西德人對移民十分反感。根據英國近年解密的文件，就任西德總理不久的科爾（Helmut Kohl）曾向英國官員表示，想把一半土耳其外勞送回國，他甚至公開說過，「德國不是移民國家」，居德外國人只是居住者。如今，情況卻大有不同。至少，德國足球國家隊已有不少移民／移民後代。事實上，在經濟危機後多了如西班牙、希臘等歐盟成員國人民因經濟差而往德國找工作，另一方面，德國接收了大量難民，去年接到逾２０萬宗難民申請，這令德國近年已成為全球第二大移民接收國，僅次種族大融爐美國。對一個十分強調血統主義的國家來說，這有點難以想像。不得不說，其實德國對技術/工作等原因歸化的移民還是十分友好的，尤其歡迎科學和工程學背景的年輕人。 職業市場上工程師的用工缺口很大，是需要引進的。 擅長照顧老年人的醫護人員也十分緊缺。 很久以前有聽人說過好像歸化條件之一是必須在德國工作繳稅滿 8 年，幾年前這個條件縮到 6 年。 只要申請者夠條件，手續也是很簡單，跟德國留個世人的官僚刻板印象很不一樣。 前不久剛剛聽說，這裡 15 歲以下的人口中，有移民背景的人占到 40% 還要多，聽上去很多移民的樣子，但是個人感覺國際化程度跟荷蘭等地方還是不能比。 這裡東亞人好像明顯沒有荷蘭那裡多，德語真的是那麼難以逾越的障礙嗎？俄羅斯國防部週五表示 ，對烏克蘭的「特別軍事行動」的「第一階段」已「大致」完成，在新階段，行動將集中在「解放」烏東頓巴斯地區（Donbas）。綜合一下烏克蘭戰爭第28天的政治及軍事消息。北約成員國將決定，在東邊接近俄羅斯的4個成員國大幅增兵，同時，被視為「普京引薦人」的俄羅斯政壇元老丘拜斯（Anatoly Chubais，照片右）辭任所有政府職位，並已流亡。美國總統拜登週六晚在波蘭華沙發表演說 ，結語時揚言俄羅斯總統普京不應再掌權。白宮官員隨即以不具名方式澄清，表示這個說法不代表美國想推翻普京。,fb07e491-3dce-4928-a007-a4f69747431b,0
188,http://europechinese.blogspot.com/2015/01/blog-post_20.html,1/19/2015 09:53:00 下午繼瑞士央行１５日突然撤銷瑞士法郎匯率上限後，歐洲再有一個央行採取行動，遏止貨幣兌歐元升值，那就是丹麥。丹麥央行（上面照片來自央行網站）突然提前至１９日宣佈貨幣政策變動，把存款利率由－０．０５厘再減０．１５厘至－０．２厘，以捍衛丹麥克朗與歐元的聯繫匯率。說是「突然」、「提前」，是因為丹麥傳統上是在歐洲央行議息當天的下午４時公佈貨幣政策決定。丹麥央行的最主要功能就是捍衛丹麥克朗與歐元的滙率，因此丹麥在絕大部份情況下都是跟隨歐洲央行的決定。今次丹麥央行未等歐洲央行行動就宣佈減息，可見丹麥克朗面對龐大升值壓力。丹麥央行今次行動的背景，跟瑞士央行上週行動一樣，都是擔心歐洲央行２２日會宣佈啟動購買國債的計劃，令市場湧現大批歐元，拖累歐元下跌，而資金要找出路，因此湧向資金避難所。原本資金避難所在歐洲非瑞郎莫屬，但現在瑞士央行進一步減息，因此資金可能湧向丹麥。另外，瑞郎的匯率上限可以突然消失，令投資（機）者開始尋找下一個可能會取消固定匯率的貨幣，首當其衝的就是丹麥克朗。因此，這項公佈令人意外的，也只在於公佈時間。減息的決定屬意料中事。不過，瑞士和丹麥有很大分別。首先，瑞郎在全球外匯市場的重要性、在全球外匯交易所佔的比例，遠遠高於丹麥克朗，瑞郎佔全球約５％外匯交易，但丹麥克朗不足１％，而瑞士的避險地位亦遠高於丹麥，更不要說瑞士的經濟亦遠較丹麥為好。因此，丹麥克朗匯價被低估的情況不及瑞郎嚴重，而一旦該貨幣出亂子，影響亦不會如瑞郎。而且，瑞郎的匯率上限２０１１年才實施，是臨時措施，但丹麥目前的聯擊匯率制度早在８０年代初參加歐洲匯率機制（ＥＲＭ）時就實施至今，早期與西德馬克（或ＥＣＵ？）掛鈎，１９９９年後改與歐元掛鈎，目前的目標滙率是１歐元兌７．４６０３８丹麥克朗，上下波幅２．５％。最重要的是，這是丹麥央行跟歐洲央行簽署了協議的機制，不像瑞士央行般可自己隨時決定實施或取消，而在有需要時歐洲央行會協助遏低丹麥克朗匯率。在９０年代初索羅斯（George Soros）衝擊英鎊，就是衝擊ＥＲＭ制度，丹麥當時也可抵擋得住，現在的壓力不會較當時高。畢竟，當時炒家是打賭歐洲其他貨幣兌德國馬克下跌，而現在是打賭丹麥克朗上升。防守一種貨幣的匯率制度，永遠是擋住打賭下跌較打賭升值容易。不過，丹麥央行應該還要進一步減息，才可保住聯繫匯率，最快可能在２２日歐央行議息後再行動。此外，歐洲另外２個央行瑞典和挪威亦相信被迫要跟隨，減息甚至印鈔，以免自己的貨幣升值。現在歐洲（除英國外）基本上就是齊齊阻止自己貨幣升值。俄羅斯國防部週五表示 ，對烏克蘭的「特別軍事行動」的「第一階段」已「大致」完成，在新階段，行動將集中在「解放」烏東頓巴斯地區（Donbas）。綜合一下烏克蘭戰爭第28天的政治及軍事消息。北約成員國將決定，在東邊接近俄羅斯的4個成員國大幅增兵，同時，被視為「普京引薦人」的俄羅斯政壇元老丘拜斯（Anatoly Chubais，照片右）辭任所有政府職位，並已流亡。美國總統拜登週六晚在波蘭華沙發表演說 ，結語時揚言俄羅斯總統普京不應再掌權。白宮官員隨即以不具名方式澄清，表示這個說法不代表美國想推翻普京。,bb9394fe-7e64-499a-bca2-4604bee4a9e4,0
189,https://www.beclass.com/rid=2546555617b6ee6a3e55,紙本講義、證書將以郵寄方式寄出，請務必確認收件地址是否正確。4.本課程需前後測。5.如無穩定網路、鏡頭視訊設備者，請勿報名，感謝配合。報名方法及相關事項說明，請務必詳閱：一律採用網路(信箱)報名，報名三日內（不含例假日）將寄email通知繳費資訊，請於五日內繳費以完成報名程序。(1).簡章刊戴課程，本社保有決定是否開課及調整時間講師等之權利，如因報名人數不足未達開班之故會另行通知，及辦理退費(2).開課日期前第7日至第1日提出退費申請者，退還實際應繳納費用總額80%，並酌收500元行政退費費用。(3)凡退費者須酌收行政費用500元(4).上課期間所收取之當期費用得全數不予退還。(5).通知繳費、上課地點、或更改等事宜採網路信件通知或簡訊。(6).兩天課程不供應餐點，請學員自理。✅個人資料保護法聲明個人資料保護法聲明依據個人資料保護法（以下稱個資法）第八條第一項規定，為了確保使用者之個人資料、隱私及權益之保護，當您已閱讀並勾選同意時，即表示您願意以電子文件之方式行使法律所賦予同意之權利，並具有書面同意之效果，若不同意請離開此網頁。 (以下為本單位依「個人資料保護法」規定，必須向您告知的各項聲明，請您務必詳閱。) 一、 個人資料蒐集目的： （一）從事資訊、通訊傳播、出版、影片服務、聲音錄製、音樂出版、傳播、節目播送、電信、電腦系統設計、資料處理及資訊供應服務等之行為均屬於本行業之個資蒐集目的。 （二）上述之相關業務或其他符合營業項目所定義之工作範圍。 二、 個人資料蒐集類別： （一）識別類（例如：中、英文姓名、國民身分證統一編號、識別碼、學生或員工證號、聯絡電話號碼、地址、性別、出生地、電子郵遞地址、帳戶號碼與戶名、其它識別證號或電子識別標章）、特徵類（例如：出生年月日、國籍、個人照片、筆跡與紙本文件）、社會情況類（例如：職業、學經歷）、財務細節類（例如：銀行帳號、戶名或與本蒐集目的相關之財務資訊）等。 另活動照片將會置放於本單位之社團、粉絲專業、等本單位之。三、 個人資料利用之期間、地區、對象及方式： （一）期間：利用期間為本單位或業務所必須之保存期間。 （二）地區：您的個人資料將用於本單位提供服務之地區。 （三）對象：您的資料「不會」被用於共同行銷、交互運用客戶資料公司、合作推廣單位或業務往來機構。後續相關課程之通知除外。 （四）方式：電子文件、紙本，或以自動化機器或其他非自動化之利用方式。 四、 依據個資法第三條規定，您就本單位保有您的個人資料得行使下列權利： （一）查詢、閱覽、複本、補充、更正、請求停止蒐集、請求停止處理、請求停止利用、請求刪除等權利。 主辦單位保有修訂本告知內容之權利，修正時亦同。以上條文參考自中華民國資料保護協會。公告日期: 2020.09.22 | | E-MAIL: fuding109109@gmail.com,509fde93-00ab-40d3-83ca-9caf8994f67b,0
190,https://www.beclass.com/rid=26488c861d3ade8613fc,"漳和濕地於111年2月份，每週二、四、五、六提供機關團體上下午各一場團體之導覽解說服務，歡迎一起來體驗漳和濕地之美。活動日期：每週二、四、五、六活動時間：上午場次09:20-11:30 / 下午場次13:20-15:30集合地點：中和區清潔隊入口(中和清潔隊管制站旁)活動內容：漳和濕地導覽解說【上午場次】09:20~09:30活動報到(中和清潔隊管制站旁)09:30~09:4009:40~11:2015:20~15:30Q&A，民眾參訪心得分享15:30~活動結束全程免費，每場次限40位名額，額滿為止。於入園14日前預約(不接受現場及當天報名),每一場次40名為限，未滿10人則該場次取消。報名規則很重要！請各位務必詳細閱讀並遵守園區方制定的報名規則，以避免令您自己的權益受損，以及造成園區方工作人員的困擾。注意事項：為防範「嚴重特殊傳染性肺炎〈新型冠狀病毒病(COVID-19)〉」疫情擴散，敬請參觀民眾一起協助以下 #防疫措施，造成參觀不便之處敬請見諒：本活動須配合實名制，活動現場會查驗每位身分證明文件，請攜帶相關證件，本園區入口處備有酒精，煩請配合手部消毒。參觀民眾如自國外入境有發燒、咳嗽、疲勞倦怠等不適症狀，敬請配戴口罩，建議取消參觀行程，並儘速就醫。01.活動對象：一般民眾，12歲以下須有陪同者(年滿18歲)報名陪同，如需陪同者請將陪同者(須年滿18歲)資料請填寫報名表欄位，未滿12歲如無填寫陪同者資料將不受理。02.活動地點採實名認證，沒有報名及攜帶身分證件本園區有權利禁止進入。03.報名所需資料為辦理保險使用，主辦單位不會作其他私人用途，請放心填寫。取人員若不克前來，請於活動三日前通知。05.如遇惡劣天氣等不可抗力因素，主辦單位在活動前一天將通知擇日舉行。06.請自備充足的飲用水，視天氣情形攜帶雨具、防蚊、防曬等用品。07.個人可攜帶照相機、放大鏡、望遠鏡等觀察工具。08.為避免驚嚇到戶外生物，最好不要穿著色澤過度鮮豔的服裝，並請輕聲交談。09.園區內無飲水設備及垃圾桶，請自行攜帶飲用水及將垃圾帶走。10.因參加者眾多，請家長自行照顧好孩童。11.活動當天準時開始，逾時不候。12.因活動場域寵物不得入內，因此請勿攜帶寵物參加。13.主辦單位保留修改、終止、變更活動內容細節之權利。如遇惡劣天氣等不可抗力因素，主辦單位保有隨時修改活動辦法及中止本活動之權利，任何變更內容或詳細注意事項將公布於本網頁，恕不另行通知。14.如對活動有相關疑問，歡迎於開放時間來電/來信聯絡單位。主辦單位：新北市政府環境保護局承辦單位：財團法人台灣水利環境科技研究發展教育基金會(TIIWE)聯絡單位：濕地故事館開放時間：週一至週五 時間為上午9點至下午5點，週六至週日時間為上午9點至下午5點30分。休館時間：每月第一個星期一，其他休館日請參考漳和濕地公告。",38725f51-3242-4b66-a881-3578c5db2d11,1
191,https://www.beclass.com/rid=26488c761d2b03caf624,"、輔具衛教課程目的：為提供老年人、失能及身心障礙者完善照護服務，本課程分享提升老年人、失能及身心障礙者各類服務量能及培訓各類老年人、失能及身心障礙者照顧專業人員，改善民眾生活品質，減少年老、失能及身心障礙者所帶來的衝擊，並加強專業人員對相關策略及未來成果的共識及認同，提升其對老年人、失能及身心障礙者認知及友善態度。。年04月10日(星期日) 上午10:00至下午17:00本會會員、志工、長期照顧相關專業從業人員、社工、護理人員、照顧服務員、一般大眾…等等及對於課程主題有興趣者。主辦單位：社團法人中華照顧服務發展協會報名期間為即日起至 111 年 04 年 09 日。3.課程費用：會員費用600元、非會員750元。報名費含師資、電子講義、長照積分認證費、電子證書、材料費。課程午餐自理(用餐時間1小時)。團體報名3人同行:700元/人。團體報名5人同行:650元/人。團體報名10人同行:600元/人4.課程繳費資訊：戶名：社團法人中華照顧服務發展協會銀行代號：807 永豐銀行 內壢分行銀行帳號：189-018-0004618-7銀行臨櫃、ATM或網銀繳費5.報名繳費資訊：提醒您報名後待通知繳款。通知繳款後三天內未入帳或未信件通知匯款資料即取消報名資格。請務必加Line ID：@728kduhb (協會官方帳號：https://lin.ee/qKuLRKz )，並傳匯款相關訊息至官方帳號，出納才能核對。或傳電子信箱：careyou66@gmail.com。信件傳送通知：繳費後信件告知、參加課程、匯款時間、匯款後五碼。十、時數認證：本課程長照人員繼續教育認證6積分，認證字號【老盟長照審字第11101056號】。十一、課程注意事項因應疫情，進入機構請佩戴口罩。2.主辦單位有權力異動課程和講師。3.響應環保請自備水杯及環保餐具。4.若遇颱風，依桃園市政府公告停班停課情形辦理。5.學員需全程完成 20 小時課程，中途缺席恕無法提供研習證明及長照積分。6.課程當天皆有影像拍攝與紀錄，報名本活動即同意個人肖像權供主辦單位紀錄使用。7.報名經審查符合受訓條件者，依匯款優先順序予以錄取，直至報名額滿為止。8.完成填單與匯款後，務必加入本機構line官方帳號回傳姓名、電話、匯款日期、帳號後五碼、長照人員證明，後續課程通知將以官方帳號發送。十二、課程內容與議程表：本課程內容規劃依「衛生福利部110年度長照服務人員繼續教育之實施方式」規定※注意※辦理，少於30天則按退費規則。例如: 課程1月20日舉辦，課程延期申請為12月20日23:59之前辦理。【課程退費規則】【退款100%】課程舉辦首日前一個月辦理例如: 課程04月10日舉辦，3月10日之前辦理退費者。【退款70%】課程舉辦首日15日前辦理例如: 課程04月10日舉辦，3月11日至3月24日辦理退費者。【退款40%】課程舉辦首日7日前辦理例如: 課程04月10日舉辦，3月25日至4月3日辦理退費者。【不接受退款】課程舉辦首日至前7日例如: 課程04月10日舉辦，4月4日00:00之後不受理課程退費。《全額退款需扣除200元行政費》一、學員特殊情況全額退費規定1.學員課前7日至當日遇突發疾病、喪事並出示地區責任醫院急診室之就診證明者。(含一等親之親屬)2.課程當日官司訴訟或交通事故出具證明者。3.報名課程後至開課當日不預期懷孕者。《全額退款需扣除200元行政費》二、特殊情況全額退費規定課程當日發生天災或其他不可抗力情事,依照地方政府公告停止上班上課為基準，將全額退費(若遇課程舉辦期間則不退費，另行公告時間辦理)例如: 同場次課程04月10日期間，課程開始後，若地方政府公告停止上班上課則另行公告延期時間不退費。【課程規定】1.遲到或中途離席者及冒名頂替者，經發現將不予發放訓練證書及登錄積分不得要求退款。2.嚴重影響上課秩序，學員集體反映不接受規勸者及不願離開者，視情況報請當地警察機關協助處裡。3.嚴禁講師、學員於課程期間推銷產品或發放機構傳單徵才。4.本主辦單位課程活動不得推銷產品、不開放相關機構任何形式之徵才廣告。個人資料保護法聲明個人資料保護法聲明依據個人資料保護法（以下稱個資法）第八條第一項規定，為了確保使用者之個人資料、隱私及權益之保護，當您已閱讀並勾選同意時，即表示您願意以電子文件之方式行使法律所賦予同意之權利，並具有書面同意之效果，若不同意請離開此網頁。 (以下為本單位依「個人資料保護法」規定，必須向您告知的各項聲明，請您務必詳閱。) 一、 個人資料蒐集目的： （一）從事資訊、通訊傳播、出版、影片服務、聲音錄製、音樂出版、傳播、節目播送、電信、電腦系統設計、資料處理及資訊供應服務等之行為均屬於本行業之個資蒐集目的。（二）上述之相關業務或其他符合營業項目所定義之工作範圍。 二、 個人資料蒐集類別： （一）識別類（例如：中、英文姓名、國民身分證統一編號、識別碼、學生或員工證號、聯絡電話號碼、地址、性別、出生地、電子郵遞地址、帳戶號碼與戶名、其它識別證號或電子識別標章）、特徵類（例如：出生年月日、國籍、個人照片、筆跡與紙本文件）、社會情況類（例如：職業、學經歷）、財務細節類（例如：銀行帳號、戶名或與本蒐集目的相關之財務資訊）等。另活動照片將會置放於本單位之社團、粉絲專業、等本單位之。三、 個人資料利用之期間、地區、對象及方式： （一）期間：利用期間為本單位或業務所必須之保存期間。 （二）地區：您的個人資料將用於本單位提供服務之地區。（三）對象：您的資料「不會」被用於共同行銷、交互運用客戶資料公司、合作推廣單位或業務往來機構。後續相關課程之通知除外。 （四）方式：電子文件、紙本，或以自動化機器或其他非自動化之利用方式。四、 依據個資法第三條規定，您就本單位保有您的個人資料得行使下列權利：（一）查詢、閱覽、複本、補充、更正、請求停止蒐集、請求停止處理、請求停止利用、請求刪除等權利。 主辦單位保有修訂本告知內容之權利，修正時亦同。以上條文參考自中華民國資料保護協會。",23c5482d-bebf-4c6a-b3c5-7d8b5058eb92,0
192,https://hotline.org.tw/civicrm/event/info?id=322&reset=1,This site can’t be reachedhotline.org.twrefused to connect.,e7fa3b45-3fff-45b4-8e7d-72c30e28a9ff,1
